{
  "type": "file",
  "path": "a.png",
  "kind": "image",
  "mime": "image/png",
  "encoding": "base64",
  "content": "iVBORw0KGgo=",
  "url": "/raw/a.png",
  "size": 8,
  "mtime": 1700000000000.5,
  "created": 1699999999000.5,
  "git": {
    "commit": "abc",
    "author": "Rob",
    "date": 1700000000,
    "message": "init",
    "repoUrl": "https://github.com/rob/x"
  },
  "inReplyTo": "r"
}
